{
  "active": false,
  "activeCandidates": [],
  "candidates": [
    {
      "category": "events",
      "confidence": 0.95,
      "crawl": {
        "crawlStatus": "completed",
        "crawlTimestamp": "2026-10-02T16:30:00Z",
        "failureReason": null,
        "httpStatus": 200,
        "robotsDecision": "allowed"
      },
      "dataType": "ICS/iCalendar",
      "evidenceUrls": [
        "https://www.durhamnc.gov/Calendar.aspx",
        "https://www.durhamnc.gov/Calendar.aspx?EID=10435&month=10&year=2026&day=2&calType=0",
        "https://www.durhamnc.gov/common/modules/iCalendar/iCalendar.aspx?feed=calendar&eventID=10435"
      ],
      "id": "national-source-75f41a7405d31278",
      "markets": [
        "Durham"
      ],
      "originatingOfficialDomains": [
        "durhamnc.gov"
      ],
      "originatingSeed": "expansion-queues/national-region-seeds.csv",
      "publicationState": "research-only",
      "publisher": "City of Durham Official Calendar",
      "queryContext": [
        {
          "market": "Raleigh-Durham",
          "officialDomain": "durhamnc.gov",
          "queryFamily": "events",
          "queryId": "nrq-fec1896a54ef",
          "seed": "expansion-queues/national-region-seeds.csv"
        }
      ],
      "queryFamilies": [
        "events",
        "rss_ics"
      ],
      "queryIds": [
        "nrq-fec1896a54ef"
      ],
      "researchOnly": true,
      "reviewState": "needs_human_review",
      "scoreBreakdown": {
        "explicit_timezone_location": 0.15,
        "official_detail_page": 0.3,
        "reachable_ics": 0.35,
        "stable_uid": 0.15
      },
      "url": "https://www.durhamnc.gov/common/modules/iCalendar/iCalendar.aspx?feed=calendar&eventID=10435"
    }
  ],
  "errors": [],
  "generatedAt": "2026-10-02T16:15:22.247227Z",
  "kind": "national-discovery-candidate-package",
  "publicationState": "research-only",
  "runtimeLoader": "not-consumed; human promotion required",
  "schemaVersion": 1,
  "sourceArtifacts": [
    "expansion-queues/durham-focused-event-capture.json",
    "expansion-queues/national-region-search-queue.json"
  ],
  "summary": {
    "duplicateUrlsMerged": 0,
    "excluded": 0,
    "needsHumanReview": 1,
    "rejectedInvalid": 0,
    "researchCandidates": 1,
    "stagedPackageRecords": 1
  }
}
